{
  "vertical_id": "uk-llb",
  "display_name": "UK Law (LLB) — Pakistani student, September 2026 intake",
  "student_context": {
    "origin_country": "Pakistan",
    "destination_country": "United Kingdom",
    "course": "LLB (Bachelor of Laws)",
    "intake": "September 2026",
    "home_city": "Lahore"
  },
  "currency": {
    "quote_currency": "GBP",
    "symbol": "£",
    "report_currency_secondary": "PKR",
    "gbp_to_pkr_rate": 374.0,
    "rate_note": "Interbank rate 2026-07-18 (exchangerates.org.uk). Update before demo; hardcoded fallback if FX API unavailable"
  },
  "benchmarks": {
    "_sources_note": "All figures verified against official pages on 2026-07-19. Where a university sets country-specific deposits, the figure below is the one for Pakistani-domiciled applicants.",
    "published_deposits": [
      {
        "university": "Queen Mary University of London",
        "deposit_gbp": 2000,
        "note": "All overseas applicants needing a Student visa, payable before CAS",
        "source": "https://www.qmul.ac.uk/international-students/tuitionfees/deposits/"
      },
      {
        "university": "University of Manchester",
        "deposit_gbp": 6000,
        "note": "Higher deposit specifically for applicants domiciled in Pakistan, Bangladesh and Ghana (standard is £1,000)",
        "source": "https://www.manchester.ac.uk/study/masters/fees-and-funding/international-student-fees/tuition-fee-deposits/"
      },
      {
        "university": "UWE Bristol",
        "deposit_gbp": 8500,
        "note": "Pre-registration payment requirement (from hackathon brief; UWE varies by course)",
        "source": "https://www.uwe.ac.uk/courses/fees/paying-your-fees/international-student-payment"
      },
      {
        "university": "University of Hull",
        "deposit_gbp": 10000,
        "note": "Applicants from Pakistan, Bangladesh, Ghana and Nigeria (standard is £4,000)",
        "source": "https://www.hull.ac.uk/study/international-students/how-to-apply/tuition-fee-deposits"
      },
      {
        "university": "University of Leicester",
        "deposit_gbp": 8000,
        "note": "Applicants from Pakistan, payable before CAS issuance",
        "source": "https://le.ac.uk/study/postgraduates/fees-funding/how-to-pay/deposit"
      },
      {
        "university": "Northumbria University",
        "deposit_gbp": 5500,
        "note": "Minimum tuition fee deposit, all international applicants, 2026/27",
        "source": "https://www.northumbria.ac.uk/study-at-northumbria/fees-funding/international-fees-funding/international-money-matters/"
      },
      {
        "university": "Coventry University",
        "deposit_gbp": 8000,
        "note": "Minimum payment before enrolment; Pakistani applicants may be asked for full first-year fees",
        "source": "https://www.coventry.ac.uk/international-students-hub/fees-and-funding/how-to-pay/"
      }
    ],
    "ukvi_maintenance": {
      "outside_london_gbp_per_month": 1171,
      "london_gbp_per_month": 1529,
      "months_required": 9,
      "note": "28-day held-funds rule applies; closing balance within 31 days of application",
      "source": "https://www.gov.uk/student-visa/money",
      "verified": "2026-07-19"
    },
    "visa_fee_gbp": 558,
    "visa_fee_note": "Student visa applied for from outside the UK; rose from £524 on 8 April 2026",
    "visa_fee_source": "https://www.gov.uk/student-visa",
    "ihs_gbp_per_year": 776,
    "ihs_note": "Immigration Health Surcharge, student rate per year of visa (unchanged at April 2026)",
    "ihs_source": "https://www.gov.uk/healthcare-immigration-application/how-much-pay",
    "ielts_fee_pkr": {
      "academic_computer": 71920,
      "ukvi": 72000,
      "note": "Lahore pricing 2026; Karachi ~PKR 600 cheaper",
      "source": "https://ielts.idp.com/pakistan/news-ielts-test-fee",
      "verified": "2026-07-19"
    },
    "typical_tuition_gbp_range": [15000, 28500],
    "tuition_note": "LLB international 2026/27 entry: Hull ~£18,100, QMUL £25,150+, Manchester £28,400; post-92 universities from ~£15,000",
    "service_fee_market_range_gbp": [0, 500],
    "market_floor_total_gbp": 300,
    "market_floor_note": "Estimate from market knowledge, not a published figure: consultancy charging under £300 total is likely recovering costs via hidden fees or commission-only placements"
  },
  "quote_items": [
    "service_fee",
    "university_application_fee",
    "deposit",
    "visa_processing_fee",
    "ihs_surcharge",
    "document_attestation",
    "ielts_booking",
    "other"
  ],
  "red_flag_rules": [
    {
      "id": "deposit_padding",
      "description": "Quoted deposit exceeds the university's published deposit figure",
      "check": "quoted_deposit > published_deposit_for_university",
      "severity": "high",
      "agent_line": "The published deposit for {university} is £{published}. Can you explain why you're quoting £{quoted}?"
    },
    {
      "id": "below_market_floor",
      "description": "Total consultancy charges below market floor — likely hidden fees later",
      "check": "total_consultancy_charges < market_floor_total_gbp",
      "severity": "medium",
      "agent_line": "That's well below what other consultancies charge. Are there any fees that come up later in the process?"
    },
    {
      "id": "guaranteed_visa",
      "description": "Claims of guaranteed visa or guaranteed admission",
      "check": "transcript_contains_guarantee_claim",
      "severity": "high",
      "agent_line": "I understood visa decisions are made only by UKVI. Is that guarantee in writing?"
    },
    {
      "id": "pressure_tactics",
      "description": "Artificial urgency: pay-today discounts, 'last seat' claims",
      "check": "transcript_contains_urgency_claim",
      "severity": "low",
      "agent_line": "I won't be deciding today. Does that offer stand if I come back next week?"
    }
  ],
  "negotiation": {
    "levers": [
      {
        "id": "competitor_service_fee",
        "line": "Another consultancy quoted £{amount} for the same service. Can you match or beat that?"
      },
      {
        "id": "fee_waiver_ask",
        "line": "Some consultancies charge no service fee because universities pay them commission. Why should I pay yours?"
      },
      {
        "id": "bundle_ask",
        "line": "If I use you for the visa file as well, can you waive the application service fee?"
      },
      {
        "id": "lower_deposit_university",
        "line": "Another consultancy can route the same course through {university} with a {currency}{amount} deposit. Do you have a lower-deposit option?"
      },
      {
        "id": "itemisation_ask",
        "line": "Before any total, I need each fee itemised separately — service, application, deposit, visa."
      }
    ],
    "honesty_constraints": [
      "Never invent grades, IELTS scores, or financial figures — use only the confirmed StudentProfile.",
      "Never fabricate a competitor offer — leverage lines may cite ONLY amounts returned by the get_leverage tool.",
      "Never accept or promise payment on the call."
    ],
    "target_outcomes": ["quote", "callback_commitment", "documented_decline"]
  },
  "ai_disclosure": {
    "policy": "disclose_when_asked",
    "line": "Yes — I'm an AI assistant calling on behalf of a real student who reviews everything I gather. Are you comfortable continuing?"
  },
  "personas": [
    {
      "id": "commission_pusher",
      "name": "Adeel — SkyBridge Consultants",
      "style": "Friendly, evasive on fees, pushes commission-paying universities (Hull, UWE) over the student's stated preferences, dodges itemisation twice before yielding.",
      "resistance": "Deflects fee questions with 'package deals'; only itemises when pressed a third time.",
      "concession_rule": "Drops service fee from £350 to £200 only when confronted with a cheaper competitor quote.",
      "quote_sheet": {
        "universities_pushed": ["University of Hull", "UWE Bristol"],
        "fees": [
          { "item": "service_fee", "amount_gbp": 350, "when": "only_when_pressed", "note": "hidden inside 'the package' until the third direct ask; drops to £200 ONLY against a named cheaper competitor quote" },
          { "item": "university_application_fee", "amount_gbp": 90, "when": "on_request", "note": "per application" },
          { "item": "deposit", "amount_gbp": 10000, "when": "volunteered", "note": "University of Hull — matches published figure; pitched as 'totally standard for Pakistani students'" },
          { "item": "deposit", "amount_gbp": 8500, "when": "volunteered", "note": "UWE Bristol — matches published figure" },
          { "item": "deposit", "amount_gbp": 8000, "when": "on_request", "note": "University of Manchester — PADDED above the published £6,000 (calls the extra 'our facilitation reserve, refundable'). Deposit-padding red-flag bait." },
          { "item": "document_attestation", "amount_gbp": 0, "when": "on_request", "note": "'included in the package' — refuses to price it separately" }
        ]
      }
    },
    {
      "id": "fee_hider",
      "name": "Maryam — Crescent Education",
      "style": "Professional and precise, but quotes a low headline fee and reveals attestation/courier/file charges only when asked directly per-item.",
      "resistance": "Answers only exactly what is asked; never volunteers extra fees.",
      "concession_rule": "Waives the £100 'file opening' charge if the caller flags the below-market-floor red flag.",
      "quote_sheet": {
        "universities_pushed": ["Queen Mary University of London", "University of Manchester"],
        "fees": [
          { "item": "service_fee", "amount_gbp": 0, "when": "volunteered", "note": "'our counselling is completely free' — the below-market-floor red-flag bait" },